PostNumber,DiseaseID,Disease,SymptomIDs,Symptoms,ThreadLink,ThreadHeading,ThreadContent
3,C0009443,Common Cold,C0232431,Cold sweat,https://connect.mayoclinic.org/discussion/horrible-hives/,Horrible Hives,"Hello! iv had hives since the beginning of last December and they are absolutly MISSiRABLE!!! Iv been to my regular doc she had given me a steroid shot and pill thought i was allergic to something and had referred me to an immulologist. Later that evening my hives got worse so i just went to the hospital to get it checked out but that was pointless and waste of money i was told the same thing and the doc had given me another steroid shot which i had told her didnt help earlier that day which is why i was there. I ended up never sleeping at night having hot/cold sweats taking alot of antihistamines that felt like forever. Did end up getting an appointment with an immulologist and skin test came out that i wasnt allergic to anything, and blood work was normal. Now iam taking 2 180mg tablets of Allegra,Montelukast SOD, Ranitidine all TWICE a day and if i skip or if im late on a dose i start getting the hives really bad. Iam going to see an Indocrinologist early next week also. I wish i could figure this out!! I cant stand it anymore just wondering if it is caused by an underlying disease? .Thanks for reading any suggestions will help! Follow Report"
3,C0042109,Urticaria,C0232431,Cold sweat,https://connect.mayoclinic.org/discussion/horrible-hives/,Horrible Hives,"Hello! iv had hives since the beginning of last December and they are absolutly MISSiRABLE!!! Iv been to my regular doc she had given me a steroid shot and pill thought i was allergic to something and had referred me to an immulologist. Later that evening my hives got worse so i just went to the hospital to get it checked out but that was pointless and waste of money i was told the same thing and the doc had given me another steroid shot which i had told her didnt help earlier that day which is why i was there. I ended up never sleeping at night having hot/cold sweats taking alot of antihistamines that felt like forever. Did end up getting an appointment with an immulologist and skin test came out that i wasnt allergic to anything, and blood work was normal. Now iam taking 2 180mg tablets of Allegra,Montelukast SOD, Ranitidine all TWICE a day and if i skip or if im late on a dose i start getting the hives really bad. Iam going to see an Indocrinologist early next week also. I wish i could figure this out!! I cant stand it anymore just wondering if it is caused by an underlying disease? .Thanks for reading any suggestions will help! Follow Report"
6,C0041912,Upper Respiratory Infections,"C0085624, C0581297","Burning sensation, lump on head",https://connect.mayoclinic.org/discussion/sweat-that-is-ruining-my-lifehelp/,Sweat that is ruining my life(Help),"Hi everyone, I would like to apologize in advance for such a lengthy post but to start off,Im 18 years old 511 175 lbs male and this past year Ive been dealing with excessive sweating usually from the armpit and inside the buttcrack area. It didnt bother me that much until On October 24, I started having this burning/heat sensation on the upper buttcrack part or i would say my tailbone area. That area would sweat so much and Ive observed the sweat occurs when I walk outside,run do any physical activity and also during urination. After Im done urinating, I would feel the sweat coming out of that tailbone area. Ever since october my sweat overall has become alot worse. My armpits would sweat even in the cold and that heat sensation Ive been feeling in my tailbone, i have also started feeling it in between my groin area. It would also sweat there when i walk. This between the groin area sweat started probably on Nov 24. These excessive sweating symptoms have made me so anxious and depressed. I cant even wear anything but black and white shirts and basketball shorts or people will notice the sweat has seeping in my clothes. Additionally, I think this may be related but at the beginning of the year probably late February. My testicle area on the left started feeling pain. Then one day, I peed myself while in class without even realizing it. Good thing no one else noticed and i quickly changed my pants. So I went to the doctors and said everything was fine. I think they x rayed the lower back area and found no issues. Then all hell wouldnt stop as the following months later I felt a small not growing lump on my neck which the doctor thinks is a lymph node. And now its November and during the 16th, I noticed two hard lumps on the back of my head but I think it might be because i had a bad cold but I have had it. Im visiting the doctors tomorrow to consult about my excessive sweat and if any of these may be related to it. I didnt even excessively sweat last year only this year when all of these happened. I dont know if I should see a neurologist,urologist,dermatologist or get a biopsy. What makes me so scared is what if this is lymphoma, a type of cancer, an infection or anything uncurable What if my excessive sweating on the tailbone and pretty much my body swear will never be cured. All these make me so scared. Makes me sad how all those people my age are enjoying life while I suffer these delibirating symptoms. Does anyone have any idea what this tailbone,groin and armpit sweat could possibly be? (I know its hyperhidrosis but could it be from another cause) Follow Report"
9,C0013595,Eczema,C1579931,Depressed - symptom,https://connect.mayoclinic.org/discussion/episodes-of-itchy-blistery-looking-bumps-on-the-backs-of-my-knuckles/,"Episodes of itchy, blistery-looking bumps on the backs of my knuckles","This is an on-going case of flareups of viciously itchy, blistery-looking bumps on the backs of my hands, particularly the knuckles, which has never gone completely away. I've had it for a long time, and it flares up in episodes. I've recently had severe flare-ups, so it seems to be getting worse. I have clobetasol propionate cream which helps and takes about five days to two weeks to get it under control. The bumps look like blisters, but are solid inside  no fluid. They are pretty much only on my knuckles, on the back and sides of my fingers. My dermatologist thought it might be caused by soap, but I've tried all sorts of soaps and I'm no longer convinced soap is the culprit. I think it may be a symptom of something internal (viral?). I want to know what this stuff is, and if we can eradicate it. It is miserable, itches like poison oak. So far it has not spread to any other places but the backs of my hands, primarily the right one. My PA, based solely on the attached photographs and description (not an exam) thought it might be dishydrotic eczema, but I am getting referred back to another dermatologist (I requested a different one from the one I saw before). I want this gone. It is torturous. Added: When this subsides, the skin dries and peels off of where the blister-looking places were. Follow Report"
27,C0750466,Yeast infection,C2926602,"Discharge, body substance",https://connect.mayoclinic.org/discussion/yeast-infection-help/,Yeast infection help,"Hey three days ago I had signs of a yeast infection and I went to the doctor; he prescribed cephalexin and ketoconazole both of which Im suppose to take/use three times a day. My questions are, the antibiotics are for what exactly as from my research they dont really positively effect yeast infections and also on applying the ketoconazole I notice that after washing off any discharge and drying it off, when I apply the anti fungal, that minutes later it will start having a clear discharge which turns into a mucus white transparent discharge hours later, is that ok/normal as I know keeping the area dry is important? -Im uncircumcised and the area is my foreskin/side on penis glans. Thanks. Follow Report"
28,C4554344,IgE-mediated food allergy,"C0221423, C0013604, C0221232","Illness (finding), Edema, Welts",https://connect.mayoclinic.org/discussion/i-need-help-1/,I need help,Okay so I got sick in January 2005 I have been sick ever since I have hives everyday as fine some days and some days I have hives and swelling I have really bad breakout some days and not so bad other days but everyday I have hives if you give me steroids or antihistamines it makes it worse Ive been all over the state of Missouri Ive had ever blood test under the sun right now I think and nobody can figure it out I just want to know if anybody knows any kind of rare disease or any other possibility that somebody knows something out there that could help me I have now been doing this for 14 years and have no more answers today than I had the day it started and his all over my body theres no Rhyme or Reason Im not allergic to any food Ive had food allergy test done thats all Ive loved her keeps coming back normal so if anybody knows anything it would be great to know so if you could help me at all that would be awesome thank you Liked by Leonard Follow Report
28,C0678236,Rare Diseases,"C0221423, C0013604, C0221232","Illness (finding), Edema, Welts",https://connect.mayoclinic.org/discussion/i-need-help-1/,I need help,Okay so I got sick in January 2005 I have been sick ever since I have hives everyday as fine some days and some days I have hives and swelling I have really bad breakout some days and not so bad other days but everyday I have hives if you give me steroids or antihistamines it makes it worse Ive been all over the state of Missouri Ive had ever blood test under the sun right now I think and nobody can figure it out I just want to know if anybody knows any kind of rare disease or any other possibility that somebody knows something out there that could help me I have now been doing this for 14 years and have no more answers today than I had the day it started and his all over my body theres no Rhyme or Reason Im not allergic to any food Ive had food allergy test done thats all Ive loved her keeps coming back normal so if anybody knows anything it would be great to know so if you could help me at all that would be awesome thank you Liked by Leonard Follow Report
28,C0042109,Urticaria,"C0221423, C0013604, C0221232","Illness (finding), Edema, Welts",https://connect.mayoclinic.org/discussion/i-need-help-1/,I need help,Okay so I got sick in January 2005 I have been sick ever since I have hives everyday as fine some days and some days I have hives and swelling I have really bad breakout some days and not so bad other days but everyday I have hives if you give me steroids or antihistamines it makes it worse Ive been all over the state of Missouri Ive had ever blood test under the sun right now I think and nobody can figure it out I just want to know if anybody knows any kind of rare disease or any other possibility that somebody knows something out there that could help me I have now been doing this for 14 years and have no more answers today than I had the day it started and his all over my body theres no Rhyme or Reason Im not allergic to any food Ive had food allergy test done thats all Ive loved her keeps coming back normal so if anybody knows anything it would be great to know so if you could help me at all that would be awesome thank you Liked by Leonard Follow Report
36,C0042109,Urticaria,"C0015230, C0857057","Exanthema, blotchy",https://connect.mayoclinic.org/discussion/hives-at-night/,Hives at night,"For the past five nights, including tonight, I have been experiencing a reaction of some sort. I assume that they are hives. The weird thing is that it only happens, well 95% of the time, the breakout starts in the evening. I know it's not from a bite or something because they are in different spots each night I have had an allergy test ..that was done a few years back and it came back negative. Not allergic to anything. I know that can change, but I just find it odd that this only happens at night. During the day, I am fine just anxious know what's to come after sundown. Another thing I noticed is that they are usually in straight lines.. not always, sometimes they are blotchy but a lot of the time they are in lines. I have taken benadryl every night for the past few nights didn't work. Tonight I got a little bit of relief but I can already feel my body getting itchy. Hydrocortisone creams do nothing. I think I just apply them for piece of mind. I called my primary's after hours answering service and spoke with my doc. I have an appt with her in the morning and she is going to do bloodwork and give me steroid shots, but I just wanted to see if anyone else has experienced anything like this before or know someone who has. They usually last for the night. When I can finally get myself to sleep at night.. in the morning i am fine. They dont leave any markings or anything. They are just red and raised and extremely itchy. Any input will help. Thanks in advance. Follow Report"
37,C0004364,Autoimmune Diseases,C0040822,Tremor,https://connect.mayoclinic.org/discussion/body-itching/,Body itching,"Ive had almost unbearable itching for over 3 months. Was prescribed hydroxyzine, but it doesnt seem to help. It started when I was in the ER having a very frightening allergic reaction. I was given an epinephrine iv, and a breathing treatment. My legs started to shake uncontrollably. Then I couldnt breathe, was given an injection of something at that point. Im taking benadryl and paxil but dont know how much longer I can deal with this. Liked by John, Volunteer Mentor, lioness, jeanne5009, Brightwings AKA Cute Susie ... see all Follow Report"
38,C0263325,Grover's disease,C0015230,Exanthema,https://connect.mayoclinic.org/discussion/55-yo-female-with-grovers-disease/,55 y/o female with Grover's Disease,"I was recently diagnosed with Grover's disease although I am not convinced it's proper diagnosis. The rash coincides with the purchase of a new polyurethane mattress. However, I have since moved to another room and it persists so it could be coincidence. It started on my temples as little bumps that had an INTENSE ITCH and then they slowly progressed over a couple months down the back of my head, then neck, upper, back, then low back and around to my stomach with a few small outbreaks on my elbows. I was superscribed prednisone which was a god send. It stopped the itching completely and the bumps almost completely disappeared. Until I ran the course, and it all came back with a vengeance! The itching is awful! I can't sleep. No antihistamines work, no over the counter creams work. It's only been about three months since this all started and I can't imagine living like this for years! I have had custody of my 16 month old grand daughter since her birth so I can't afford to lose any more sleep! I need HELP! Liked by Ethan McConkey, Moderator Follow Report"
39,C0007286,Carpal Tunnel Syndrome,C0015230,Exanthema,https://connect.mayoclinic.org/discussion/contact-dermatitis-after-surgical-procedures/,Contact Dermatitis after surgical procedures,"My husband has had several orthopedic surgeries (4 shoulder, 3 carpal tunnel and a knee) and ever since the 2nd surgery he blisters very badly. Hes had the whole skin patch testing done, but nothing showed a reaction. Nothing for tape, gauze, cleansers, etc. Has anybody ever had this happen? Im attaching a picture of what happened after surgery this past Wednesday. The blisters always start onday 2. Hes on a double dose of prednisone which calms the blistering and rash down. He had 2 skin biopsies done yesterday but not sure if they will give us any answers. Thank you. Follow Report"
41,C0175697,Van der Woude syndrome,"C0036572, C0015230, C0231218, C0231617, C0030193","Seizures, Exanthema, Malaise, Catch - Finding of sensory dimension of pain, Pain",https://connect.mayoclinic.org/discussion/shingles-rash-and-pain/,Shingles rash and pain,"Im in week 10 of shingles and still have crusted blisters in my arm pit. Why are they still there and how do I get rid of them? I feel like the pain wont start easing there until they are gone. I had severe pain for 3 days in my left shoulder blade. When it started to ease I felt blisters on my back. I went to urgent care and was diagnosed with shingles. I took acyclovir for 7 days and then nothing. My doctors office wouldnt fit me in and insisted I wait for a regular slot so I didnt see him for 3 weeks. In the meantime i then got the rash and blisters on the underside of my left arm, in my arm pit and over the left side of my breast. The rash slowly crusted on my back leaving ugly scabbing and holes on my back. That left and I just have a large discolored area on my back that is fairly painful. The rash and crusted blisters on my chest took longer to go away and the pain only left the sides of the breast. I still have pain in the middle and top near my armpit. The last to start going was my underarm and armpit and the pain has been awful. Better than it was but . Im worried Ill never get rid of the pain but what worries me even more is the crusted blisters in my armpit havent made any progress in at least 2 weeks. I hope someone knows a magic way to make those go away. THey said the rash would only last 10 days to 2 weeks but its now 10 weeks. I have low-level MDS so I catch things easier and they tend to last longer. Follow Report"
41,C0019360,Herpes zoster disease,"C0036572, C0015230, C0231218, C0231617, C0030193","Seizures, Exanthema, Malaise, Catch - Finding of sensory dimension of pain, Pain",https://connect.mayoclinic.org/discussion/shingles-rash-and-pain/,Shingles rash and pain,"Im in week 10 of shingles and still have crusted blisters in my arm pit. Why are they still there and how do I get rid of them? I feel like the pain wont start easing there until they are gone. I had severe pain for 3 days in my left shoulder blade. When it started to ease I felt blisters on my back. I went to urgent care and was diagnosed with shingles. I took acyclovir for 7 days and then nothing. My doctors office wouldnt fit me in and insisted I wait for a regular slot so I didnt see him for 3 weeks. In the meantime i then got the rash and blisters on the underside of my left arm, in my arm pit and over the left side of my breast. The rash slowly crusted on my back leaving ugly scabbing and holes on my back. That left and I just have a large discolored area on my back that is fairly painful. The rash and crusted blisters on my chest took longer to go away and the pain only left the sides of the breast. I still have pain in the middle and top near my armpit. The last to start going was my underarm and armpit and the pain has been awful. Better than it was but . Im worried Ill never get rid of the pain but what worries me even more is the crusted blisters in my armpit havent made any progress in at least 2 weeks. I hope someone knows a magic way to make those go away. THey said the rash would only last 10 days to 2 weeks but its now 10 weeks. I have low-level MDS so I catch things easier and they tend to last longer. Follow Report"
44,C0011603,Dermatitis,"C0023222, C0015230, C0455270","Pain in lower limb, Exanthema, Sharp pain",https://connect.mayoclinic.org/discussion/rash/,Rash,"Im hoping someone can help us with this. My husband got a nerve block last summer. He had been suffering from a sharp pain in his left leg. Strong enough that it would cause him to fall to the ground. The nerve block stopped the leg pain. Approximately 2 weeks after the nerve block, he developed a rash on his arms and calves. Its very symmetrical. Same on both sides of his body, nothing on face, neck or torso. He was diagnosed with dermatitis, but nothing seems to get rid of it. He also has several lung nodules. Ive done research on my own and saw a case where a man had lung nodules and once they were removed the rash went away. I also wonder if its related to the nerve block he had in his leg and the rash starting right after that. It just seems very odd to me that its only on these areas of his body and it started right after the nerve block. Hes had numerous allergy tests, creams, wet wraps and pills. Nothing gets rid of it. Has anyone experienced anything like this? Were very frustrated. Follow Report"
45,C0162429,Malnutrition,C3839047,Severe dry skin,https://connect.mayoclinic.org/discussion/extreme-dry-skin-circular-patches/,"Extreme dry skin circular ""patches""?","I don't even know how to describe this. For maybe the past month or so, I've noticed suddenly having extremely flaky dry skin on my feet (particularly the right side of my body, if that's even possible). It's honestly been on the low end of my priority list due to a plethora of other more debilitating health issues. Then several days ago, I noticed a ""patch"" of rough, red and irrirtated looking skin on each hand just slightly above the carpus. Doesn't hurt, doesn't itch, just obviously doesn't seem healthy. Fed up, with both my feet and now this odd hand thing, I went and got a pedicure and a paraffin dip for my hands. Everything looked great for about 2-3 hours! Now suddenly those ""patches"" on my hands are dry and rough again. I'm baffled, I'm fed up with weird mysterious health issues that no one can diagnose/link together, and exasperated with all the special ""health tips"" being prescribed by the various specialists that  if I could somehow manage to maintain them all  would get my body to the normal person level. Making an appointment with a new dermatologist is on my to-do list, for many reasons, but anyone have any thoughts on what this could be, and/or suggestions for potential treatment? I was diagnosed with Keratosis pilaris atrophy as a baby, and still have the Keratosis pilaris-looking bumps on my upper arms. A million other health issues at the moment. A1C is normal though. Receiving treatment for B12 and D deficiencies. Super dry mouth and eyes, currently lips as well, but ANA panel and SS-A and SS-B antibodies negative. The day before I noticed these ""patches"", the left side of my lip randomly swelled up for about an hour and a half  no idea what that was about either. Anything else, feel free to ask. Follow Report"
46,C0242301,furuncle,C0015230,Exanthema,https://connect.mayoclinic.org/discussion/nickel-allergy-cured/,Nickel allergy cured,"This is kind of strange, but thats what prompted me to come here in order to post this. I want some kind of record since I am (hopefully and presumably) not the only one affect in this manner. I have had a nickel allergy all of my life. I first discovered it in my early childhood by wearing blue jeans where the back of the button would leave a rash on my lower stomach. Through the years, I have learned to stay away from nickel and other metalsexcept that I play guitar. My love for the guitar and my nickel allergy have always been foes. I would practice and play until I would begin to get a rash. Oddly, the rash would change where it occurred almost monthly. Early on, it would appear on my inner thighs. In my mid-teens it would show up on my fingers; in-betweeneczema-like. From then on, it mostly would irritate my fingers, but sometimes on my upper-right leg (like at the bottom of my right butt cheek). It has also caused boils on the bottom of my feet, although they seem to contain water and dont itch a ton. Over the years my conditions seem to slightly get better, but it has always been unpredictablesometimes after playing for a couple of days a lot, I have not been too bad, and sometimes after playing for 10 minutes, I would really get a rash badly. I have tried strings made of gold and another type made of stainless steel. The gold strings did indeed minimize the effects of the allergy, but severely degraded the playability and toneAND the cost was significantly higher making it not feasible to continue to use them on a regular basis. Stainless steel strings were heavy, didnt sound as good, and still produced symptoms, possibly in part to the materials in the actual guitar (frets, pickups, etc.) and not the strings themselves. So I was dining with my family and I ordered an Asian dish. I had really crazy spices in itsomething I had not tasted beforeand for the next three days, I had a rash that pretty much was all over my body (but concentrated in my midsection). That is the last time I remember having a nickel allergy. I usually play guitar for a couple hours a week  10 minutes here and there, take a couple days off, play for 1/2 hour, dont play for a day or two I had a makeshift schedule in my head that until now I hadnt even thought about. This allowed my to limit my exposure to nickel. That bring us to today. I bought a new guitar (Paul Reed Smith if you must know lol!) and have been playing it like crazy. I noticed the lack of rash. I noticed the explicit absence of any reaction whatsoever. Whats the deal? I dont know what to think. I am ecstatic, but at the same time a little reluctant to think its totally cured. I have played for a minimum of 45 minutes per day since I first discovered the lack of reaction. So in the last few weeks, I have probably played more than I had played in the last six months or more. Does anyone have any idea why this would happen all of the sudden? I am cautiously optimistic and am hoping and praying my allergy is finally cured. Thanks in advance for any insight. Follow Report"
