PostNumber,DiseaseID,Disease,SymptomIDs,Symptoms,ThreadLink,ThreadHeading,ThreadContent
81,C0034734,Raynaud Disease,"C0557875, C0231617, C0030193, C0004604, C0917801, C0392674, C0028643, C0221423, C0542476, C0042571, C2242996, C0314719, C0751372","Tired, Catch - Finding of sensory dimension of pain, Pain, Back Pain, Sleeplessness, Exhaustion, Numbness, Illness (finding), Forgetful, Vertigo, Has tingling sensation, Dryness of eye, Nerve Pain",https://messageboards.webmd.com/health-conditions/f/multiple-sclerosis/53209/having-symptoms-and-taking-forever-to-find-out-what-s-causing-them,Having symptoms and taking forever to find out what's causing them,"I am very frustrated at this point. The past year has been awful for me. This may be a long post because I haven't been able to really talk to anyone about this and how it is affecting me because when I first start to say something about it people usually shrug it off and say I am just tired or being lazy. With that said, here it goes. About 10 year ago, I started having difficulty dealing with cold. My hands started to turn really red. I just shrugged it off because I just thought that was a normal thing. This progressed through the years and now my fingers turn completely white, numb, and painful. I did find out this past February (after going to the dr for other symptoms) that I have Raynauds. I just want to say real quick here that I don't normally go to the doctor unless everything I try at home won't work. Three years ago, I had this black circle appear in my vision in my right eye. It was so annoying and lasted two and a half months. The eye had a bit of a yellowish tint to it and what appeared to be a raised area between the iris and the outer corner of my right eye. It also felt like there was something in it. After I freaked out, I called my eye doctor and went in to have it checked. He said he couldn't see anything out of the ordinary and sent me to a specialist. Same response from the specialist and was given eye drops for dry eyes. This went away after two and a half months. I didn't think much of it after that. This past year it has come back a few different times. By searching online I come to find out that it is called a stocoma. My current dr said that the reason the eye doctor and specialist couldn't find anything is because it is neurological. I kept getting sick easy about a year ago and was going to the dr about every three months for the cold, ear infection, and the flu. So my current dr sent me to a rheumatologist and they did some auto immune tests and they came back showing something was going on but still no diagnosis. I was sent home with a rx of vitamin d (which my current dr and I was unhappy with because my vitamin D levels were good). Then I woke up one morning in so much pain in my back last year the I couldn't even get out of bed. I was literally in tears. Had to call my mom to have her take the kids to school for me and come back and take me to the dr. I ended up at a neuro and spine surgeon and two MRIs and xrays later was told I have two degenerative discs (one in my tail bone and one in my neck). Then the nerve pain. I have had what feels like a needle prick in three different places on my head. This has been going on for a couple of years. It starts out as a quick needle prick and then spiderwebs out into a numbing sensation. These are quick and come and go. I have had constant numbness, tingling, and pain since about February of last year. This affects my arms, hands, feet, and legs. It affects my walking. I also have a constant pain going down from the top of my left thigh to the knee on the backside. Was sent for a nerve conduction and after the forth time she shocked me I told her I couldn't go through with it. It felt like sticking your finger in an electrical outlet. It was horrible! I am completely exhausted and tired all of the time. Sometimes to the point it will hit me so fast and all I can do is lay down. I also have insomnia and getting 4 hours of straight sleep is a good day. Then there is the cognitive issues. It started out as being a little forgetful. Sometimes I open the pantry door and find that I had put the milk in there or I open the fridge door and find the bag of sugar in there. I caught myself the other day in the act of putting my dirty dish in the fridge when I was actually going to put it in the dishwasher. This just happens every once in a while. If my kids have something going on like a dance performance they have to remind me everyday up until the day of. Even when it is written on the calendar I keep up in the dining room. I have speech issues. Sometimes I can't find the right word to use (even if it is a common one). I usually describe the item and add the word ""thingy"" after it. Like if I can't think of the word scissors I will say that little hand held cutting thingy. This happens a bit more often than I would like to admit. Some words I say have an extra letter in them that are not supposed to be there. The other day the letter z slipped in a word of one of my sentences. A few years ago, I told my daughter when she was finished eating lunch to through her paper plate in the garbage and her fork in the ""toaster"". I clearly meant the ""sink"". I even knew in my head I was going to say sink but to my surprise the word toaster rolled out of my mouth. When this started it was weird but we all thought it was kind of funny. Happened a few more times over the course of three weeks and then I was fine again. Now I struggle with my words throughout the day. My kids think it is still funny when I struggle to say something and I usually just shrug it off as normal for me now. I don't let them know that it really is frustrating to me. I was diagnosed with vertigo in February and am on Mecklezine now which it does help. I am also on Lyrica for nerve pain. I was on Gabapentin but it seemed to not work. I have been on Lyrica for three weeks now and can actually move more and it has helped so much with my nerve pain. I am truly thankful to have it right now. I also get a tight feeling around my lower rib cage that goes all the way around my back. It feels like a giant snake is wrapped around me and squeezes me so tight. Feels like my insides are being crushed into my spine. The worst one I had woke me up in the middle of the night I ended up in the fetal position in the middle of my bedroom floor in tears for two and a half hours. I get them here and there any time of day. But in the past year I have actually had them during work, which makes things extremely difficult. I also trip over nothing and have a hard time going up stairs. I have fallen three times in the past few years because my right leg from the knee down feels non-existent. There is a few more things but I am going to leave it at that for now. I just feel so frustrated because I have been dealing with the worst of this since last year. It is affecting my work and I have taken off so many days. I am sure they are thinking I am just lazy. I don't want to lose my job. It is a really good one and I worked so hard to get it. I even got a bachelor's degree so it would give me a leg up in the hiring process. But I am falling apart and the doctor's seem to take forever to tell me what is causing all of this. I need a diagnosis and proper paperwork to take into my boss so that they know what is going on. For now I just tell them that if I have to wait for a diagnosis so do they. Which, in all honesty, is not the best thing to say. Without the proper paper work I must look like a lazy person who is making up things. I just don't know where to go from here. I am supposed to be set up with a neurologist and have been waiting for a call from them for two weeks now. I am running out of money for dr's app and they need to figure out what is wrong fast."
82,C0026769,Multiple Sclerosis,"C3714552, C0030193","Weakness, Pain",https://messageboards.webmd.com/health-conditions/f/multiple-sclerosis/54437/multiple-sclerosis,Multiple Sclerosis,"Anybody get pain and no Doctor wants to prescribe pain relief?? I was diagnosed with MS in 2004, but I also was diagnosed with Fibromygia in 1995. My muscles seem to be getting weaker with anything I do, where before, if I walked or did yard and garden work, I may have been soar, but stronger. Now its like I am getting weaker. I am 63. Doc told me 50/50 in a wheelchair by 65 and I don't think I can handle that!"
86,C0026769,Multiple Sclerosis,"C0028643, C0015644, C0023222, C0858724, C0015672, C0150055, C2242996, C3714552","Numbness, Muscular fasciculation, Pain in lower limb, twitching of limbs, Fatigue, Chronic pain, Has tingling sensation, Weakness",https://messageboards.webmd.com/health-conditions/f/multiple-sclerosis/40932/ms,MS..?,"I am a 23 year old female suffering from chronic leg pain, tingling and reduced sensation. I'm extremely fatigued and feel very weak sometimes. Back in late November I experienced numbness in the right side of my face that subsided in about an hour or 2. I also expirience muscle/limb twitching and jerks on a daily basis. This past friday I experienced another episode of numbness but on the left side of my face and tongue. It is now Monday the 19th of february and I am still experiencing this numbness and it occasionally spreads to my whole face but then will return to just my left side and can't seem to get my left arm to hang on very well without dropping something or getting it where i need it in time to stop a cabinent door from slamming. I have reduced sensation from the neck down as well. Blood work and CT scan of head and neck were all normal. Does anybody have some suggestions on what this may be or what to talk to my doctor about??? Thank you!"
90,C0016053,Fibromyalgia,"C0518214, C0037088, C0030193","Perceived quality of life, Signs and Symptoms, Pain",https://messageboards.webmd.com/health-conditions/f/multiple-sclerosis/42008/pain-medications,Pain medications,"I have had MS since possibly 45. I am now 63. I have been on ultram for many years and it seems to help keep my mind balance and the pain within reason. My regular doctor of many many yrs has retired and I have been feeling like so bullied taking 2 ultrams a day from 4 doctors. Even my primary care that I have been seeing for over a year is telling me the ultram has to go. She also made me give up the few vicodins I got a month when pain broke through. With all this frustration, I now have anxiety. So those meds have also been manipulated away from me. They did piss tests me on for over a year and NO, i am not an addict. So what is working for people who have MS pains plus I have fibromyalgia. I had to go around my doctor, trying to find another doctor and she at last referred me to pain clinic. However, she would not take me on as new patient due to being prescribed ultrams. What is going on?? anybody got a clue. I don't do well with smoking pot. My doctor wants to put me down a rigorous mental medications treatments, and I am so allergic to any anti depressant they have tried me on for the past 20 yrs. I am not chemically depressed, but the anxiety is there at times, but my guess I am feeling bullied and my stability is at risk, which I believe in return, may put me in a tail spin of the MS> I am on no meds, I walk and fight this disease, but feel like I am losing the battle with finding a descent doctor. Even my neurologist is saying well, pain pills are the number 1 problem of opioids in this country. Well, some of us survive on a few pills a day to have a quality of life. Why punish us all that have known issues and quite documented. Any suggestions??"
92,C1856053,Hydranencephaly with Renal Aplasia-Dysplasia,"C0423572, C0085624","Pins and needles, Burning sensation",https://messageboards.webmd.com/health-conditions/f/multiple-sclerosis/65847/recently-diagnosed,Recently Diagnosed...,"I was officially diagnosed this past March, but have been dealing with symptoms for over 2 years. Long story short, I have little to no feeling or sensation in my hands & feet other than the constant burning pins & needles, & now I have difficulty driving... I was wondering if anyone could tell me how I'd go about getting the hand controls for my car? I know there's a class I have to take, etc. but I haven't been able to figure out where to begin... Thank you, your help is greatly appreciated!"
95,C0021167,Incontinence,"C0028643, C0239375, C0027497, C0015672, C0012833, C2242996, C0018681, C3714552, C0917801","Numbness, Numbness of limbs, Nausea, Fatigue, Dizziness, Has tingling sensation, Headache, Weakness, Sleeplessness",https://messageboards.webmd.com/health-conditions/f/multiple-sclerosis/48117/is-it-worth-mentioning-to-my-doctor,Is it worth mentioning to my doctor?,"Hello, I am a 33 year old Caucasian female. I have not been diagnosed with MS and don't have a family history that I am aware of. However, I seem to have most of the symptoms associated with the disease. My memory is horrible; I can forget what a topic of a conversation was after a small pause and will often forget why I was trying to figure out something in my head, for example this morning I was trying to figure out how much I get paid per day at my job and as soon as I had the simple equation in my mind I forgot why I was doing the math. I remembered after something else slipped my mind in the same way, which I can't remember what it was. I have the worst insomnia. I get tired quickly through physical activity. Taking a shower often takes all the energy out of me and I have to force myself to finish tasks if I have multiple to accomplish. Once I'm done I will be down for the rest of the day. If I get hot I almost immediately feel dizzy and nauseated. I have a headache every day. I have been diagnosed with anxiety and depression and take medication for those. My balance is not the best. I often trip on flat ground because I just don't lift my foot high enough. Along with that I am very clumsy. I run into door jams or tables, as well as other things, because I misjudge the space I have to go between or how sharp of a turn to make. I easily drop things for no reason. My legs easily move when I need to walk and I have no issues moving body parts when I need to. My vision is bad and I wear prescription glasses, although I have had this problem since I was in my teens and most of my relatives also wear glasses. My prescription does get slightly worse every year, however. I will not realize that my, (often left leg/foot) is asleep until after I try to walk on it. My balance is bad, especially when attempting to exercise. (I will lose balance while doing squats despite having arms stretched out and a straight back after 10 or so, for example.) Yoga is very hard solely due to balance. My strength and flexibility is improving through yoga but my balance is where it was day 1. I have a couple things I am not sure are associated but I wonder if could be: I don't have any numbness in my limbs or extremities other than the falling asleep thing described above. However, I have a weird numbing sensation in my back on the left in a very specific location, which sort of feels like a tingling sensation from like a light fabric being repeatedly brushed over the area. Quite a few months ago I had the same sensation on the right side. The last thing I am experiencing has to do with my bladder. I don't have incontinence or accidents. I actually have the opposite problem , I will unequivocally have a full bladder and as soon as I sit on the toilet, I am unable to go. It takes several minutes and when I do, the stream is weak and I have to use all the strength I have to squeeze the urine out of my bladder. During the time I am urinating if I try to just let it flow, I will stop. This is more likely to happen after I have been holding it, or don't have fluids in my system to help ease it along, such as in the middle of the night or first thing in the morning. During the day, as I drink water throughout the day, I easily go, frequently. I'm talking every 30 minutes to an hour for the first half of my day, even if I am just sipping the water. I understand that that, as well as many of the symptoms I described can be associated with many things. I just want to know if the problems with the numbness in my back and emptying my bladder could be associated with MS along with everything else I described. How should I approach my doctor with these symptoms and my suspicions? Could I have just fallen into the rabbit hole when I was trying to figure out why I can't pee and why my back has that weird tingling? Should I wait and see if my symptoms get worse?  Thank you for reading and I appreciate replies. I apologize for length, I wanted to give as much detail as possible."
95,C4522181,Brachial Amyotrophic Diplegia,"C0028643, C0239375, C0027497, C0015672, C0012833, C2242996, C0018681, C3714552, C0917801","Numbness, Numbness of limbs, Nausea, Fatigue, Dizziness, Has tingling sensation, Headache, Weakness, Sleeplessness",https://messageboards.webmd.com/health-conditions/f/multiple-sclerosis/48117/is-it-worth-mentioning-to-my-doctor,Is it worth mentioning to my doctor?,"Hello, I am a 33 year old Caucasian female. I have not been diagnosed with MS and don't have a family history that I am aware of. However, I seem to have most of the symptoms associated with the disease. My memory is horrible; I can forget what a topic of a conversation was after a small pause and will often forget why I was trying to figure out something in my head, for example this morning I was trying to figure out how much I get paid per day at my job and as soon as I had the simple equation in my mind I forgot why I was doing the math. I remembered after something else slipped my mind in the same way, which I can't remember what it was. I have the worst insomnia. I get tired quickly through physical activity. Taking a shower often takes all the energy out of me and I have to force myself to finish tasks if I have multiple to accomplish. Once I'm done I will be down for the rest of the day. If I get hot I almost immediately feel dizzy and nauseated. I have a headache every day. I have been diagnosed with anxiety and depression and take medication for those. My balance is not the best. I often trip on flat ground because I just don't lift my foot high enough. Along with that I am very clumsy. I run into door jams or tables, as well as other things, because I misjudge the space I have to go between or how sharp of a turn to make. I easily drop things for no reason. My legs easily move when I need to walk and I have no issues moving body parts when I need to. My vision is bad and I wear prescription glasses, although I have had this problem since I was in my teens and most of my relatives also wear glasses. My prescription does get slightly worse every year, however. I will not realize that my, (often left leg/foot) is asleep until after I try to walk on it. My balance is bad, especially when attempting to exercise. (I will lose balance while doing squats despite having arms stretched out and a straight back after 10 or so, for example.) Yoga is very hard solely due to balance. My strength and flexibility is improving through yoga but my balance is where it was day 1. I have a couple things I am not sure are associated but I wonder if could be: I don't have any numbness in my limbs or extremities other than the falling asleep thing described above. However, I have a weird numbing sensation in my back on the left in a very specific location, which sort of feels like a tingling sensation from like a light fabric being repeatedly brushed over the area. Quite a few months ago I had the same sensation on the right side. The last thing I am experiencing has to do with my bladder. I don't have incontinence or accidents. I actually have the opposite problem , I will unequivocally have a full bladder and as soon as I sit on the toilet, I am unable to go. It takes several minutes and when I do, the stream is weak and I have to use all the strength I have to squeeze the urine out of my bladder. During the time I am urinating if I try to just let it flow, I will stop. This is more likely to happen after I have been holding it, or don't have fluids in my system to help ease it along, such as in the middle of the night or first thing in the morning. During the day, as I drink water throughout the day, I easily go, frequently. I'm talking every 30 minutes to an hour for the first half of my day, even if I am just sipping the water. I understand that that, as well as many of the symptoms I described can be associated with many things. I just want to know if the problems with the numbness in my back and emptying my bladder could be associated with MS along with everything else I described. How should I approach my doctor with these symptoms and my suspicions? Could I have just fallen into the rabbit hole when I was trying to figure out why I can't pee and why my back has that weird tingling? Should I wait and see if my symptoms get worse?  Thank you for reading and I appreciate replies. I apologize for length, I wanted to give as much detail as possible."
96,C0026769,Multiple Sclerosis,C0522359,"Vertigo, Constant",https://messageboards.webmd.com/health-conditions/f/multiple-sclerosis/64838/symptoms,Symptoms,Hi. Could someone please tell me what their symptoms are that alerted them to MS? Also did anyone have constant bouts of dizziness and lightheadness?
97,C0014038,Encephalitis,"C0221423, C0027497, C3714552","Illness (finding), Nausea, Weakness",https://messageboards.webmd.com/health-conditions/f/multiple-sclerosis/54811/ms,MS,"Good afternoon, i have been really sick for tge last 7 months now,, i suffered from alot of attacks like vision problems, walking problems, tingling and weakness and nausea,, my brain mri showed 2 small lesions but all the other tests was normal.. My problem is that my neurologist said my symptoms are more than what he sees on the mri so he won't diagnose me now and he wait and see as it might be mild brain inflammation that will go on its own... He asked me to wait 4 months and repeat the mri if it's the same will still wait until any changes happens... My question now can the inflammation go without medication? Can ms attacks come and goes without taking medication? I am afraid to wait and end up with critical case while I can save my case early and not live this suffer"
97,C0030554,Paresthesia,"C0221423, C0027497, C3714552","Illness (finding), Nausea, Weakness",https://messageboards.webmd.com/health-conditions/f/multiple-sclerosis/54811/ms,MS,"Good afternoon, i have been really sick for tge last 7 months now,, i suffered from alot of attacks like vision problems, walking problems, tingling and weakness and nausea,, my brain mri showed 2 small lesions but all the other tests was normal.. My problem is that my neurologist said my symptoms are more than what he sees on the mri so he won't diagnose me now and he wait and see as it might be mild brain inflammation that will go on its own... He asked me to wait 4 months and repeat the mri if it's the same will still wait until any changes happens... My question now can the inflammation go without medication? Can ms attacks come and goes without taking medication? I am afraid to wait and end up with critical case while I can save my case early and not live this suffer"
97,C0017162,"Gastroenteritis, Transmissible, of Swine","C0221423, C0027497, C3714552","Illness (finding), Nausea, Weakness",https://messageboards.webmd.com/health-conditions/f/multiple-sclerosis/54811/ms,MS,"Good afternoon, i have been really sick for tge last 7 months now,, i suffered from alot of attacks like vision problems, walking problems, tingling and weakness and nausea,, my brain mri showed 2 small lesions but all the other tests was normal.. My problem is that my neurologist said my symptoms are more than what he sees on the mri so he won't diagnose me now and he wait and see as it might be mild brain inflammation that will go on its own... He asked me to wait 4 months and repeat the mri if it's the same will still wait until any changes happens... My question now can the inflammation go without medication? Can ms attacks come and goes without taking medication? I am afraid to wait and end up with critical case while I can save my case early and not live this suffer"
99,C0026769,Multiple Sclerosis,C0564820,Pain in left arm,https://messageboards.webmd.com/health-conditions/f/multiple-sclerosis/67719/pain-ms-every-day,pain ms every day,I have pain in my left arm every day. And I feel heat on my arm
