PostNumber,DiseaseID,Disease,SymptomIDs,Symptoms,ThreadLink,ThreadHeading,ThreadContent
49,C4522181,Brachial Amyotrophic Diplegia,"C0036396, C0011991, C0221170, C0235309, C0037763, C0015672, C0231617, C0858665, C0018681, C0549248, C0030193, C0026821, C0541976, C0151315, C0003862, C0028643, C0007859, C0221423, C0009806, C0027497, C0012833","Sciatica, Diarrhea, Muscular stiffness, Upset stomach, Spasm, Fatigue, Catch - Finding of sensory dimension of pain, stomach burning sensation of, Headache, electric shock sensation, Pain, Muscle Cramp, gas in stomach, Neck stiffness, Arthralgia, Numbness, Neck Pain, Illness (finding), Constipation, Nausea, Dizziness",https://messageboards.webmd.com/health-conditions/f/multiple-sclerosis/28356/can-anyone-relate,Can anyone relate?,"I am 33 yrs old. My body is getting worse every year (usually around this season). My mom was diagnosed with MS in the 90's but hers is not progressive. I have seen multiple doctors for multiple things and no one knows what's wrong with me. I'm not a hypochondriac and believe that all of these things are related, not separate problems.  Everything escalated in 2011 when I was diagnosed with optic neuritis. I had just had my son (4th child) in Sept of 2010 before experiencing a 6 month localized headache. After 6 months of suffering from the intense pain in my left eyebrow, I realized I could touch it and trigger the pain in a specific area. My doc gave me a low dose steroid and it went away eventually. Around this time, I began experiencing sensations of water dripping on me...like water dripping on my arm or the top of my foot. I'd go to wipe it and there was nothing there.  2012 began the ""pulling"" searing pain in my neck (down into my back), the tops of my hands and the tops of my feet. At random moments without warning, it feels like an electric shock sensation ""pops"" and is followed by a hot sensation. Sometimes it feels like a tendon gets ""hung up"" and snaps. It's frustrating esp when I'm driving and just ""looking both ways"" or turning to talk to someone. I go through several months with no episodes but typically when they come back, they are frequent, unpredictable and last a few months. That same year, I lost all feeling in my right hand - my pinky, ring finger and half of my palm up through my thumb - which felt like pins and needles half of the time and a dead hand the other. I also started to experience my left hand falling asleep. I could not grip a pencil to even write like normal. I also had a very hard time going down steps because of my knees. My doctor ordered a CAT scan of my head to see if there were legions. It came back mostly clean with the exception of one spot which was inconclusive. I was referred to a neurologist who did nothing for me (he barely spoke to me, just pulled on my arms, banged on my knees and I left). He ruled out MS because I could touch my chin to my chest without triggering any pain. By this point, they decided my hand issues were probably carpal tunnel. The feeling in my hand began to return after a year. For the most part, most of my symptoms were gone.  Come Fall the next year, they returned along with very irregular and heavy menstrual cycles which made me anemic. in 2014 my bladder problems began, along with mild digestive issues. I began getting UTIs quite regularly despite my efforts to avoid them. These moved quite quickly into my kidneys, hospitalizing me with a double kidney infection and potassium deficiency. My doctor ordered a cystoscopy to make sure I was able to completely empty my bladder. Everything came back normal.  At this point, everything began to occur at the same time. The pins and needles in my limbs, twitches and spasms in random places including my face, back, legs, and hands; numbness, bladder infections, stomach problems, shocking sensations, joint pain. Then, they'd subside for months.  Last year, I developed a very stiff neck and sciatica in both my neck and lower back...sometimes at the same time. I thought I had just slept wrong but a year and several chiropractic adjustments later, it's still stiff and painful and I don't have to be doing anything for my sciatica to flare up. My husband and I were in the store one day and my sciatic nerve in my lower back sent a searing sensation that caught me off guard (I wasn't moving, just standing there talking) and my husband caught me as I began to fall. 2016 I began struggling gripping with my hands again. My doc ordered a test for arthritis which was negative. Only days later, I was sitting on the couch when my right thigh and calf muscle cramped immensely causing me to jump up and I couldn't walk...the calf felt like it could have been a blood clot, which scared me and concerned my doc so she ordered an ultrasound of my leg. It came back fine. That September, I was exercising like I always do and 2 days later, both of my wrists felt fractured. My left wrist healing within a few months while my right wrist got worse, sending me yet again to the hospital. Xray showed no break but they couldn't rule out a hairline fracture. My right wrist is still sensitive and requires a brace from time to time, especially while I sleep.  I began getting very sick every time I would eat and became severely constipated regardless of how clean my diet was. I have never struggled with irregularities at all. My doc referred me to a gastro doc who diagnosed me with IBS and introduced me to the FODmap Diet. This diet cuts out fermenting foods to avoid bad gasses in the stomach. This helped but did not correct the constipation or fullness. To this day, everything I eat won't digest properly or break down. I eat no dairy, no gluten, very little sugar or starchy foods and only drink water. I even tried a 15-day colon cleanse vitamin and couldn't use the bathroom at all by day 4 and the cramps were unbearable. This year has been the worst. I now suffer with all of these things plus bladder and bowel issues and can't eat anything without getting sick. Within the past few weeks, my face ""contracts"" (tightens starting in my nose then intensifies over my whole face from my nose upward and subsides) and I can't put my head down too far without experiencing an electric shock sensation shooting down my neck to about the bottom of my shoulder blades. At random moments lately, my whole back tightens and I can't move until it subsides. It feels like an intense ""contraction"". I recently developed neuritis again. My continued menstrual problems led me to an appointment with my gynecologist. She did an ultrasound to find that my uterus is flipped and I have a fibroid tumor which is causing the anemia and heavy bleeding. She said the constipation is a result of my uterus putting pressure on my rectum so she scheduled me a hysterectomy but I am going to cancel it on the advice of my family doctor. He says a uterus cannot cause that kind of restriction. I'm the lead singer of a rock band. On the last 2 shows of tour in September, I forgot my lyrics in the middle of the songs. During both trips, there were bouts where I was trying to talk to friends or fans and knew what I was trying to say but I couldn't get my sentences right or think of some of the words. It became so frustrating that I stopped talking altogether. I had a really rough trip to a particular festival in September. I pretty much stayed in the van all day until we performed that evening. I had a burning sensation in my stomach, couldn't walk a straight line (dizzy, fatigue, loss of balance....but I didn't eat much that day due to stomach upset). I took 6 tums, 2 gas-x pills and an over the counter nausea medicine that day..nothing brought relief. It resolved on it's own after 3 days. Yesterday morning, I woke up feeling like my gut was on fire. I couldn't wait for my husband to come home so I drove myself to the ER. The pain intensified and subsided every 5-10 minutes and made me very nauseous as well as sending a searing pain through my lower right back. This went on for 6 hours and I literally wanted to die...or cut my stomach out! They checked my blood and urine, did an ultrasound of my gallbladder, pancreas, liver and kidneys. Everything came back fine so they concluded that it's probably just the IBS.  My doc is ordering a scope to see my stomach and check for celiac, ulcers, crohn's etc. It very well could be one of these things. I came home from the hospital yesterday and experienced loss of bowel control. I soiled my pants and didn't realize until it was too late. I did the same thing this morning which is why I decided to post here. I'm so embarrassed but desperate for answers. I have been constipated for a year and now I have diarrhea (which could be a side effect of the IBS meds they gave me. But, my doc said it would take 2 weeks to take effect...it had only been 2 days). Obviously I don't WANT a disease of any kind! But I'm tired of going between different specialists to be told there's nothing wrong with me. I want answers so I can start an effective treatment plan. I'm 33 yrs young and this has only been effecting me for 6 years...I want to get ahead of whatever it is. I have 4 kids who depend on me and I've always been very active and lead a healthy lifestyle. Thank you for taking the time to read my story and give any helpful advice."
49,C0600041,Infective cystitis,"C0036396, C0011991, C0221170, C0235309, C0037763, C0015672, C0231617, C0858665, C0018681, C0549248, C0030193, C0026821, C0541976, C0151315, C0003862, C0028643, C0007859, C0221423, C0009806, C0027497, C0012833","Sciatica, Diarrhea, Muscular stiffness, Upset stomach, Spasm, Fatigue, Catch - Finding of sensory dimension of pain, stomach burning sensation of, Headache, electric shock sensation, Pain, Muscle Cramp, gas in stomach, Neck stiffness, Arthralgia, Numbness, Neck Pain, Illness (finding), Constipation, Nausea, Dizziness",https://messageboards.webmd.com/health-conditions/f/multiple-sclerosis/28356/can-anyone-relate,Can anyone relate?,"I am 33 yrs old. My body is getting worse every year (usually around this season). My mom was diagnosed with MS in the 90's but hers is not progressive. I have seen multiple doctors for multiple things and no one knows what's wrong with me. I'm not a hypochondriac and believe that all of these things are related, not separate problems.  Everything escalated in 2011 when I was diagnosed with optic neuritis. I had just had my son (4th child) in Sept of 2010 before experiencing a 6 month localized headache. After 6 months of suffering from the intense pain in my left eyebrow, I realized I could touch it and trigger the pain in a specific area. My doc gave me a low dose steroid and it went away eventually. Around this time, I began experiencing sensations of water dripping on me...like water dripping on my arm or the top of my foot. I'd go to wipe it and there was nothing there.  2012 began the ""pulling"" searing pain in my neck (down into my back), the tops of my hands and the tops of my feet. At random moments without warning, it feels like an electric shock sensation ""pops"" and is followed by a hot sensation. Sometimes it feels like a tendon gets ""hung up"" and snaps. It's frustrating esp when I'm driving and just ""looking both ways"" or turning to talk to someone. I go through several months with no episodes but typically when they come back, they are frequent, unpredictable and last a few months. That same year, I lost all feeling in my right hand - my pinky, ring finger and half of my palm up through my thumb - which felt like pins and needles half of the time and a dead hand the other. I also started to experience my left hand falling asleep. I could not grip a pencil to even write like normal. I also had a very hard time going down steps because of my knees. My doctor ordered a CAT scan of my head to see if there were legions. It came back mostly clean with the exception of one spot which was inconclusive. I was referred to a neurologist who did nothing for me (he barely spoke to me, just pulled on my arms, banged on my knees and I left). He ruled out MS because I could touch my chin to my chest without triggering any pain. By this point, they decided my hand issues were probably carpal tunnel. The feeling in my hand began to return after a year. For the most part, most of my symptoms were gone.  Come Fall the next year, they returned along with very irregular and heavy menstrual cycles which made me anemic. in 2014 my bladder problems began, along with mild digestive issues. I began getting UTIs quite regularly despite my efforts to avoid them. These moved quite quickly into my kidneys, hospitalizing me with a double kidney infection and potassium deficiency. My doctor ordered a cystoscopy to make sure I was able to completely empty my bladder. Everything came back normal.  At this point, everything began to occur at the same time. The pins and needles in my limbs, twitches and spasms in random places including my face, back, legs, and hands; numbness, bladder infections, stomach problems, shocking sensations, joint pain. Then, they'd subside for months.  Last year, I developed a very stiff neck and sciatica in both my neck and lower back...sometimes at the same time. I thought I had just slept wrong but a year and several chiropractic adjustments later, it's still stiff and painful and I don't have to be doing anything for my sciatica to flare up. My husband and I were in the store one day and my sciatic nerve in my lower back sent a searing sensation that caught me off guard (I wasn't moving, just standing there talking) and my husband caught me as I began to fall. 2016 I began struggling gripping with my hands again. My doc ordered a test for arthritis which was negative. Only days later, I was sitting on the couch when my right thigh and calf muscle cramped immensely causing me to jump up and I couldn't walk...the calf felt like it could have been a blood clot, which scared me and concerned my doc so she ordered an ultrasound of my leg. It came back fine. That September, I was exercising like I always do and 2 days later, both of my wrists felt fractured. My left wrist healing within a few months while my right wrist got worse, sending me yet again to the hospital. Xray showed no break but they couldn't rule out a hairline fracture. My right wrist is still sensitive and requires a brace from time to time, especially while I sleep.  I began getting very sick every time I would eat and became severely constipated regardless of how clean my diet was. I have never struggled with irregularities at all. My doc referred me to a gastro doc who diagnosed me with IBS and introduced me to the FODmap Diet. This diet cuts out fermenting foods to avoid bad gasses in the stomach. This helped but did not correct the constipation or fullness. To this day, everything I eat won't digest properly or break down. I eat no dairy, no gluten, very little sugar or starchy foods and only drink water. I even tried a 15-day colon cleanse vitamin and couldn't use the bathroom at all by day 4 and the cramps were unbearable. This year has been the worst. I now suffer with all of these things plus bladder and bowel issues and can't eat anything without getting sick. Within the past few weeks, my face ""contracts"" (tightens starting in my nose then intensifies over my whole face from my nose upward and subsides) and I can't put my head down too far without experiencing an electric shock sensation shooting down my neck to about the bottom of my shoulder blades. At random moments lately, my whole back tightens and I can't move until it subsides. It feels like an intense ""contraction"". I recently developed neuritis again. My continued menstrual problems led me to an appointment with my gynecologist. She did an ultrasound to find that my uterus is flipped and I have a fibroid tumor which is causing the anemia and heavy bleeding. She said the constipation is a result of my uterus putting pressure on my rectum so she scheduled me a hysterectomy but I am going to cancel it on the advice of my family doctor. He says a uterus cannot cause that kind of restriction. I'm the lead singer of a rock band. On the last 2 shows of tour in September, I forgot my lyrics in the middle of the songs. During both trips, there were bouts where I was trying to talk to friends or fans and knew what I was trying to say but I couldn't get my sentences right or think of some of the words. It became so frustrating that I stopped talking altogether. I had a really rough trip to a particular festival in September. I pretty much stayed in the van all day until we performed that evening. I had a burning sensation in my stomach, couldn't walk a straight line (dizzy, fatigue, loss of balance....but I didn't eat much that day due to stomach upset). I took 6 tums, 2 gas-x pills and an over the counter nausea medicine that day..nothing brought relief. It resolved on it's own after 3 days. Yesterday morning, I woke up feeling like my gut was on fire. I couldn't wait for my husband to come home so I drove myself to the ER. The pain intensified and subsided every 5-10 minutes and made me very nauseous as well as sending a searing pain through my lower right back. This went on for 6 hours and I literally wanted to die...or cut my stomach out! They checked my blood and urine, did an ultrasound of my gallbladder, pancreas, liver and kidneys. Everything came back fine so they concluded that it's probably just the IBS.  My doc is ordering a scope to see my stomach and check for celiac, ulcers, crohn's etc. It very well could be one of these things. I came home from the hospital yesterday and experienced loss of bowel control. I soiled my pants and didn't realize until it was too late. I did the same thing this morning which is why I decided to post here. I'm so embarrassed but desperate for answers. I have been constipated for a year and now I have diarrhea (which could be a side effect of the IBS meds they gave me. But, my doc said it would take 2 weeks to take effect...it had only been 2 days). Obviously I don't WANT a disease of any kind! But I'm tired of going between different specialists to be told there's nothing wrong with me. I want answers so I can start an effective treatment plan. I'm 33 yrs young and this has only been effecting me for 6 years...I want to get ahead of whatever it is. I have 4 kids who depend on me and I've always been very active and lead a healthy lifestyle. Thank you for taking the time to read my story and give any helpful advice."
51,C0026769,Multiple Sclerosis,C0683369,Clouded consciousness,https://messageboards.webmd.com/health-conditions/f/multiple-sclerosis/31338/ms-worsening,MS worsening ?,"Hello. My name is Amber Stanley and my father was diagnosed with progressive MS when he was 30. He is now 55 and in a wheelchair. He can no longer walk. Today I noticed something really odd. My father was trying to pay a bill online and he wasn’t comprehending that the amount was 225$. He seemed very confused and I kept asking if he was ok, and he kept responding with the same answer “I can’t comprehend this”. He said his fingers wouldn’t let him type but I watched him type in the amount. My brother came in and my dad did the same thing. He seemed so confused and lost. I’m a little worried. Does MS sometimes have this affect? Is it something I should worry about if it continues? Thank you."
56,C0026769,Multiple Sclerosis,"C0037763, C3714552, C0575090, C0026821","Spasm, Weakness, Equilibration disorder, Muscle Cramp",https://messageboards.webmd.com/health-conditions/f/multiple-sclerosis/33758/late-onset-ms-and-spasms,Late Onset MS and Spasms,"I was diagnosed with late-onset MS three years ago. My MRI showed I had lesions in my lower spine. I was having balance problems about a year earlier. For the last 3 years I have been on a drug called FAMPYRA. I take it twice a day. I'm not sure if it works but better than nothing. For the past year I have been getting muscle spasms in my left leg. I can now feel the spasms throughout my body which sort of catches my breath. I get them very frequently now. I saw my doctor yesterday and he prescribed a drug called BACLOFEN, 1/2 pill taken twice a day. I have taken two 1/2 pills so far. I haven't given them enough time to help but I feel really weak and can't concentrate on things. Yesterday I had a strong spasm in my right leg while I was driving into my driveway and couldn't take my leg off the accelerator. I crashed into my garage door and totaled it. Luckily I was going slow and didn't get hurt. I have been able to drive because I wasn't having spasms while I was sitting. I will not be driving again unless this BACLOFEN drug works. Has anyone taken this drug and had good results with spasms?"
57,C0030554,Paresthesia,"C0007859, C0015672, C0231617, C0023218","Neck Pain, Fatigue, Catch - Finding of sensory dimension of pain, Leg cramps",https://messageboards.webmd.com/health-conditions/f/multiple-sclerosis/31520/recommendation-by-my-neurologist-to-consider-stopping-meds,Recommendation by my Neurologist to Consider Stopping Meds,"I am a 69 year old female. I was diagnosed with MS in 2004. I believe I had had it for some time but the symptoms we very varied, fatigue, tingling and awful cramps in my legs, constantly tripping up stairs. The diagnoses was an accident, I had been having pain in my neck and they did an MRI which was just low enough to catch a lesion at the base of my skull. They looked further and found five other lesions. So I have been on a beta interferon, Neurontin, Provigil. On my last visit to the neurologist he said I might want to stop the beta interferon that there is not evidence that after age 65 there is still a benefit. I am just wondering if anyone else has had this advice. Honestly I am a little scared because as bad as the meds can be who  knows what would happen. I haven't been able to find a lot of information."
57,C4522181,Brachial Amyotrophic Diplegia,"C0007859, C0015672, C0231617, C0023218","Neck Pain, Fatigue, Catch - Finding of sensory dimension of pain, Leg cramps",https://messageboards.webmd.com/health-conditions/f/multiple-sclerosis/31520/recommendation-by-my-neurologist-to-consider-stopping-meds,Recommendation by my Neurologist to Consider Stopping Meds,"I am a 69 year old female. I was diagnosed with MS in 2004. I believe I had had it for some time but the symptoms we very varied, fatigue, tingling and awful cramps in my legs, constantly tripping up stairs. The diagnoses was an accident, I had been having pain in my neck and they did an MRI which was just low enough to catch a lesion at the base of my skull. They looked further and found five other lesions. So I have been on a beta interferon, Neurontin, Provigil. On my last visit to the neurologist he said I might want to stop the beta interferon that there is not evidence that after age 65 there is still a benefit. I am just wondering if anyone else has had this advice. Honestly I am a little scared because as bad as the meds can be who  knows what would happen. I haven't been able to find a lot of information."
61,C0010692,Cystitis,"C0221423, C0012833, C0018681","Illness (finding), Dizziness, Headache",https://messageboards.webmd.com/health-conditions/f/multiple-sclerosis/35789/feeling-sick,Feeling Sick,"A couple years ago I was sent to the hospital for what they believe, but haven't told me yet, MS. I have been having problems recently all over my body and am not sure what is causing it and no one will help me. They are taking a very long time to help me with anything. I began having problems back in April with my bladder. It hurt so bad, but it was that I didn't have a bladder infection, they told me. I am taking medication for my headaches and it helps with my bladder, but it hasn't cured my bladder at all. Then a few months ago I felt germs in my body, making it feel like I had pulled a muscle, but I hadn't. I took some medication, I was given and it moved to the back, I felt it. It has made my back hurt, my stomach hurt and goes where it pleases and then I started being sick from eating anything and if I don't eat anything I get really dizzy. I have to eat sugary stuff, but if I eat too much I don't feel very good from it at all. If I eat anything I feel like throwing up. I don't know what to do or have any clue what this is? Do you have a guess? Please help me."
61,C4522181,Brachial Amyotrophic Diplegia,"C0221423, C0012833, C0018681","Illness (finding), Dizziness, Headache",https://messageboards.webmd.com/health-conditions/f/multiple-sclerosis/35789/feeling-sick,Feeling Sick,"A couple years ago I was sent to the hospital for what they believe, but haven't told me yet, MS. I have been having problems recently all over my body and am not sure what is causing it and no one will help me. They are taking a very long time to help me with anything. I began having problems back in April with my bladder. It hurt so bad, but it was that I didn't have a bladder infection, they told me. I am taking medication for my headaches and it helps with my bladder, but it hasn't cured my bladder at all. Then a few months ago I felt germs in my body, making it feel like I had pulled a muscle, but I hadn't. I took some medication, I was given and it moved to the back, I felt it. It has made my back hurt, my stomach hurt and goes where it pleases and then I started being sick from eating anything and if I don't eat anything I get really dizzy. I have to eat sugary stuff, but if I eat too much I don't feel very good from it at all. If I eat anything I feel like throwing up. I don't know what to do or have any clue what this is? Do you have a guess? Please help me."
